{
  "$schema": "https://json-schema.org/draft/2020-12/schema",
  "$id": "endpoint_profile.schema.json",
  "title": "MIR EndpointProfile v1",
  "type": "object",
  "additionalProperties": false,
  "required": [
    "schema_version",
    "id",
    "model_card_id",
    "invocation",
    "account_class",
    "auth_surface",
    "machine_constraints",
    "routing",
    "enforcement",
    "evidence"
  ],
  "properties": {
    "schema_version": {
      "const": "endpoint-profile.v1"
    },
    "id": {
      "type": "string",
      "pattern": "^[a-z0-9][a-z0-9._-]*$"
    },
    "model_card_id": {
      "type": "string"
    },
    "aliases": {
      "type": "array",
      "items": {
        "type": "string"
      }
    },
    "invocation": {
      "type": "object",
      "additionalProperties": false,
      "required": ["engine", "model_identifier", "evidence"],
      "properties": {
        "engine": {
          "type": "string"
        },
        "model_identifier": {
          "type": "string"
        },
        "harness": {
          "type": ["string", "null"]
        },
        "evidence": {
          "type": "array",
          "minItems": 1,
          "items": {
            "$ref": "#/$defs/evidence"
          }
        }
      }
    },
    "account_class": {
      "type": "object",
      "additionalProperties": false,
      "required": ["value", "evidence"],
      "properties": {
        "value": {
          "type": "string"
        },
        "evidence": {
          "type": "array",
          "minItems": 1,
          "items": {
            "$ref": "#/$defs/evidence"
          }
        }
      }
    },
    "auth_surface": {
      "enum": [
        "unknown",
        "local_runtime",
        "anthropic_oauth_subscription",
        "anthropic_paid_api",
        "openai_chatgpt_subscription",
        "google_oauth_subscription",
        "manual_gui",
        "other_provider_api"
      ]
    },
    "machine_constraints": {
      "type": "object",
      "additionalProperties": false,
      "required": ["allowlist", "evidence"],
      "properties": {
        "allowlist": {
          "type": "array",
          "items": {
            "enum": ["air-m5", "pro", "mini-pro2"]
          }
        },
        "evidence": {
          "type": "array",
          "minItems": 1,
          "items": {
            "$ref": "#/$defs/evidence"
          }
        }
      }
    },
    "routing": {
      "type": "object",
      "additionalProperties": false,
      "required": ["status", "automated_routing", "evidence"],
      "properties": {
        "status": {
          "enum": [
            "eligible",
            "manual_only",
            "probation",
            "phantom",
            "denied",
            "investigation_required",
            "listed_unexploited",
            "deprecated",
            "known_unmeasured"
          ]
        },
        "automated_routing": {
          "type": "boolean"
        },
        "evidence": {
          "type": "array",
          "minItems": 1,
          "items": {
            "$ref": "#/$defs/evidence"
          }
        }
      }
    },
    "enforcement": {
      "type": "object",
      "additionalProperties": false,
      "required": ["mode", "evidence"],
      "properties": {
        "mode": {
          "enum": [
            "enforced",
            "shadow",
            "advisory_only",
            "manual_only",
            "unmeasured"
          ]
        },
        "evidence": {
          "type": "array",
          "minItems": 1,
          "items": {
            "$ref": "#/$defs/evidence"
          }
        }
      }
    },
    "exposed_capabilities": {
      "type": "array",
      "items": {
        "type": "object",
        "additionalProperties": false,
        "required": ["id", "value", "evidence"],
        "properties": {
          "id": {
            "type": "string"
          },
          "value": {
            "enum": [true, false, null]
          },
          "evidence": {
            "type": "array",
            "minItems": 1,
            "items": {
              "$ref": "#/$defs/evidence"
            }
          }
        }
      }
    },
    "restrictions": {
      "type": "array",
      "items": {
        "type": "object",
        "additionalProperties": false,
        "required": ["id", "value", "evidence"],
        "properties": {
          "id": {
            "type": "string"
          },
          "value": {
            "type": ["string", "boolean", "null"]
          },
          "evidence": {
            "type": "array",
            "minItems": 1,
            "items": {
              "$ref": "#/$defs/evidence"
            }
          }
        }
      }
    },
    "evidence": {
      "type": "array",
      "minItems": 1,
      "items": {
        "$ref": "#/$defs/evidence"
      }
    }
  },
  "$defs": {
    "evidence": {
      "type": "object",
      "additionalProperties": false,
      "required": ["level", "ref", "observed_at"],
      "properties": {
        "level": {
          "enum": [
            "declared",
            "probed",
            "benchmarked",
            "production",
            "unmeasured"
          ]
        },
        "ref": {
          "type": "string",
          "minLength": 1
        },
        "observed_at": {
          "type": "string",
          "pattern": "^\\d{4}-\\d{2}-\\d{2}"
        }
      }
    }
  }
}
