{
  "schema_version": "endpoint-profile.v1",
  "id": "ollama-qwen3.8-27b-mlx",
  "model_card_id": "qwen3.8-27b-mlx",
  "aliases": [],
  "invocation": {
    "engine": "ollama",
    "model_identifier": "qwen3.8:27b-mlx",
    "harness": "Ollama CLI/service",
    "evidence": [
      {
        "level": "probed",
        "ref": "infra/conductor/inventory_observations.v1.json#observations",
        "observed_at": "2026-08-21"
      },
      {
        "level": "probed",
        "ref": "infra/conductor/inventory_observations.v1.json#observations",
        "observed_at": "2026-08-21"
      }
    ]
  },
  "account_class": {
    "value": "local-ollama",
    "evidence": [
      {
        "level": "probed",
        "ref": "infra/conductor/inventory_observations.v1.json#observations",
        "observed_at": "2026-08-21"
      },
      {
        "level": "probed",
        "ref": "infra/conductor/inventory_observations.v1.json#observations",
        "observed_at": "2026-08-21"
      }
    ]
  },
  "auth_surface": "local_runtime",
  "machine_constraints": {
    "allowlist": ["mini-pro2"],
    "evidence": [
      {
        "level": "probed",
        "ref": "infra/conductor/inventory_observations.v1.json#observations",
        "observed_at": "2026-08-21"
      },
      {
        "level": "probed",
        "ref": "infra/conductor/inventory_observations.v1.json#observations",
        "observed_at": "2026-08-21"
      }
    ]
  },
  "routing": {
    "status": "known_unmeasured",
    "automated_routing": false,
    "evidence": [
      {
        "level": "probed",
        "ref": "infra/conductor/inventory_observations.v1.json#observations",
        "observed_at": "2026-08-21"
      },
      {
        "level": "probed",
        "ref": "infra/conductor/inventory_observations.v1.json#observations",
        "observed_at": "2026-08-21"
      }
    ]
  },
  "enforcement": {
    "mode": "unmeasured",
    "evidence": [
      {
        "level": "probed",
        "ref": "infra/conductor/inventory_observations.v1.json#observations",
        "observed_at": "2026-08-21"
      },
      {
        "level": "probed",
        "ref": "infra/conductor/inventory_observations.v1.json#observations",
        "observed_at": "2026-08-21"
      }
    ]
  },
  "exposed_capabilities": [
    {
      "id": "language",
      "value": true,
      "evidence": [
        {
          "level": "probed",
          "ref": "infra/conductor/inventory_observations.v1.json#observations",
          "observed_at": "2026-08-21"
        }
      ]
    }
  ],
  "restrictions": [
    {
      "id": "client_pii",
      "value": "local policy still applies",
      "evidence": [
        {
          "level": "declared",
          "ref": "FLEET_TOPOLOGY.json#_invariants",
          "observed_at": "2026-08-20"
        }
      ]
    }
  ],
  "evidence": [
    {
      "level": "probed",
      "ref": "infra/conductor/inventory_observations.v1.json#observations",
      "observed_at": "2026-08-21"
    },
    {
      "level": "probed",
      "ref": "infra/conductor/inventory_observations.v1.json#observations",
      "observed_at": "2026-08-21"
    }
  ]
}
