{
  "schema_version": "endpoint-profile.v1",
  "id": "kimi-kimi-for-coding-highspeed",
  "model_card_id": "kimi-for-coding-highspeed",
  "aliases": [],
  "invocation": {
    "engine": "kimi",
    "model_identifier": "kimi-for-coding-highspeed",
    "harness": null,
    "evidence": [
      {
        "level": "probed",
        "ref": "infra/conductor/inventory_observations.v1.json#observations",
        "observed_at": "2026-08-21"
      },
      {
        "level": "declared",
        "ref": "MODEL_ROSTER.md#Moonshot",
        "observed_at": "2026-08-21"
      }
    ]
  },
  "account_class": {
    "value": "moonshot-allegro",
    "evidence": [
      {
        "level": "probed",
        "ref": "infra/conductor/inventory_observations.v1.json#observations",
        "observed_at": "2026-08-21"
      },
      {
        "level": "declared",
        "ref": "MODEL_ROSTER.md#Moonshot",
        "observed_at": "2026-08-21"
      }
    ]
  },
  "auth_surface": "unknown",
  "machine_constraints": {
    "allowlist": ["pro"],
    "evidence": [
      {
        "level": "probed",
        "ref": "infra/conductor/inventory_observations.v1.json#observations",
        "observed_at": "2026-08-21"
      },
      {
        "level": "declared",
        "ref": "MODEL_ROSTER.md#Moonshot",
        "observed_at": "2026-08-21"
      }
    ]
  },
  "routing": {
    "status": "known_unmeasured",
    "automated_routing": false,
    "evidence": [
      {
        "level": "probed",
        "ref": "infra/conductor/inventory_observations.v1.json#observations",
        "observed_at": "2026-08-21"
      },
      {
        "level": "declared",
        "ref": "MODEL_ROSTER.md#Moonshot",
        "observed_at": "2026-08-21"
      }
    ]
  },
  "enforcement": {
    "mode": "advisory_only",
    "evidence": [
      {
        "level": "probed",
        "ref": "infra/conductor/inventory_observations.v1.json#observations",
        "observed_at": "2026-08-21"
      },
      {
        "level": "declared",
        "ref": "MODEL_ROSTER.md#Moonshot",
        "observed_at": "2026-08-21"
      }
    ]
  },
  "exposed_capabilities": [
    {
      "id": "language",
      "value": true,
      "evidence": [
        {
          "level": "declared",
          "ref": "MODEL_ROSTER.md#Moonshot",
          "observed_at": "2026-08-21"
        }
      ]
    },
    {
      "id": "coding",
      "value": true,
      "evidence": [
        {
          "level": "declared",
          "ref": "MODEL_ROSTER.md#Moonshot",
          "observed_at": "2026-08-21"
        }
      ]
    }
  ],
  "restrictions": [
    {
      "id": "client_pii",
      "value": "not eligible for PII/local-only routing",
      "evidence": [
        {
          "level": "declared",
          "ref": "FLEET_TOPOLOGY.json#_invariants",
          "observed_at": "2026-08-20"
        }
      ]
    }
  ],
  "evidence": [
    {
      "level": "probed",
      "ref": "infra/conductor/inventory_observations.v1.json#observations",
      "observed_at": "2026-08-21"
    },
    {
      "level": "declared",
      "ref": "MODEL_ROSTER.md#Moonshot",
      "observed_at": "2026-08-21"
    }
  ]
}
