{
  "schema_version": "endpoint-profile.v1",
  "id": "claude-glm-glm-4",
  "model_card_id": "glm-4",
  "aliases": [],
  "invocation": {
    "engine": "claude-glm",
    "model_identifier": "glm-4",
    "harness": "Anthropic-compatible shim",
    "evidence": [
      {
        "level": "probed",
        "ref": "FLEET_TOPOLOGY.json#accounts.alibaba.slots.TP1.models_measured_2026_08_21",
        "observed_at": "2026-08-21"
      }
    ]
  },
  "account_class": {
    "value": "z-ai-coding-plan",
    "evidence": [
      {
        "level": "probed",
        "ref": "FLEET_TOPOLOGY.json#accounts.alibaba.slots.TP1.models_measured_2026_08_21",
        "observed_at": "2026-08-21"
      }
    ]
  },
  "auth_surface": "unknown",
  "machine_constraints": {
    "allowlist": ["air-m5", "pro", "mini-pro2"],
    "evidence": [
      {
        "level": "probed",
        "ref": "FLEET_TOPOLOGY.json#accounts.alibaba.slots.TP1.models_measured_2026_08_21",
        "observed_at": "2026-08-21"
      }
    ]
  },
  "routing": {
    "status": "investigation_required",
    "automated_routing": false,
    "evidence": [
      {
        "level": "probed",
        "ref": "FLEET_TOPOLOGY.json#accounts.alibaba.slots.TP1.models_measured_2026_08_21",
        "observed_at": "2026-08-21"
      }
    ]
  },
  "enforcement": {
    "mode": "unmeasured",
    "evidence": [
      {
        "level": "probed",
        "ref": "FLEET_TOPOLOGY.json#accounts.alibaba.slots.TP1.models_measured_2026_08_21",
        "observed_at": "2026-08-21"
      }
    ]
  },
  "exposed_capabilities": [
    {
      "id": "language",
      "value": true,
      "evidence": [
        {
          "level": "probed",
          "ref": "FLEET_TOPOLOGY.json#accounts.alibaba.slots.TP1.models_measured_2026_08_21",
          "observed_at": "2026-08-21"
        }
      ]
    }
  ],
  "restrictions": [
    {
      "id": "client_pii",
      "value": "not eligible for PII/local-only routing",
      "evidence": [
        {
          "level": "declared",
          "ref": "FLEET_TOPOLOGY.json#_invariants",
          "observed_at": "2026-08-20"
        }
      ]
    }
  ],
  "evidence": [
    {
      "level": "probed",
      "ref": "FLEET_TOPOLOGY.json#accounts.alibaba.slots.TP1.models_measured_2026_08_21",
      "observed_at": "2026-08-21"
    }
  ]
}
