{
  "schema_version": "endpoint-profile.v1",
  "id": "qwen-happyhorse-1.1-r2v",
  "model_card_id": "happyhorse-1.1-r2v",
  "aliases": [],
  "invocation": {
    "engine": "qwen",
    "model_identifier": "happyhorse-1.1-r2v",
    "harness": "Qwen CLI",
    "evidence": [
      {
        "level": "declared",
        "ref": "FLEET_TOPOLOGY.json#accounts.alibaba.slots.TP1.console_verified_2026_08_14.unexploited_capabilities",
        "observed_at": "2026-08-14"
      }
    ]
  },
  "account_class": {
    "value": "alibaba-tp1",
    "evidence": [
      {
        "level": "declared",
        "ref": "FLEET_TOPOLOGY.json#accounts.alibaba.slots.TP1.console_verified_2026_08_14.unexploited_capabilities",
        "observed_at": "2026-08-14"
      }
    ]
  },
  "auth_surface": "unknown",
  "machine_constraints": {
    "allowlist": ["air-m5", "pro", "mini-pro2"],
    "evidence": [
      {
        "level": "declared",
        "ref": "FLEET_TOPOLOGY.json#accounts.alibaba.slots.TP1.console_verified_2026_08_14.unexploited_capabilities",
        "observed_at": "2026-08-14"
      }
    ]
  },
  "routing": {
    "status": "listed_unexploited",
    "automated_routing": false,
    "evidence": [
      {
        "level": "declared",
        "ref": "FLEET_TOPOLOGY.json#accounts.alibaba.slots.TP1.console_verified_2026_08_14.unexploited_capabilities",
        "observed_at": "2026-08-14"
      }
    ]
  },
  "enforcement": {
    "mode": "unmeasured",
    "evidence": [
      {
        "level": "declared",
        "ref": "FLEET_TOPOLOGY.json#accounts.alibaba.slots.TP1.console_verified_2026_08_14.unexploited_capabilities",
        "observed_at": "2026-08-14"
      }
    ]
  },
  "exposed_capabilities": [
    {
      "id": "video_generation",
      "value": true,
      "evidence": [
        {
          "level": "declared",
          "ref": "FLEET_TOPOLOGY.json#accounts.alibaba.slots.TP1.console_verified_2026_08_14.unexploited_capabilities",
          "observed_at": "2026-08-14"
        }
      ]
    }
  ],
  "restrictions": [
    {
      "id": "client_pii",
      "value": "not eligible for PII/local-only routing",
      "evidence": [
        {
          "level": "declared",
          "ref": "FLEET_TOPOLOGY.json#_invariants",
          "observed_at": "2026-08-20"
        }
      ]
    }
  ],
  "evidence": [
    {
      "level": "declared",
      "ref": "FLEET_TOPOLOGY.json#accounts.alibaba.slots.TP1.console_verified_2026_08_14.unexploited_capabilities",
      "observed_at": "2026-08-14"
    }
  ]
}
